{
  "$schema": "https://json-schema.org/draft/2020-12/schema",
  "$id": "https://github.com/zcxy-dev/video-editor/blob/main/packages/schema/media-index.schema.json",
  "title": "MediaIndex",
  "description": "What `vework analyze` found in one source file: the facts the editing engine plans from. Times are seconds from the file's time zero, the container's start time, not raw stream timestamps.",
  "type": "object",
  "required": ["version", "source", "transitions", "speech", "transcript"],
  "additionalProperties": false,
  "properties": {
    "version": { "const": 1 },
    "source": { "$ref": "#/$defs/SourceInfo" },
    "transitions": {
      "description": "Shot transitions found by TransNetV2, in time order.",
      "type": "array",
      "items": { "$ref": "#/$defs/ShotTransition" }
    },
    "speech": {
      "description": "Stretches of speech found by Silero VAD on the first audio track, in time order. The gaps between them are pauses.",
      "type": "array",
      "items": { "$ref": "#/$defs/SpeechSegment" }
    },
    "transcript": { "$ref": "#/$defs/Transcript" },
    "corrections": {
      "description": "Present when Claude corrected the transcript before alignment (`vework analyze --correct`): every change it proposed, applied or rejected, in time order. The transcript holds the result.",
      "type": "array",
      "items": { "$ref": "#/$defs/Correction" }
    },
    "loudness": { "$ref": "#/$defs/Loudness" },
    "audio_events": {
      "description": "Laughter, applause and music on the first audio track, found by the CED-Base AudioSet tagger, in order of start. Kinds can overlap: applause over music, music under speech. Empty without audio.",
      "type": "array",
      "items": { "$ref": "#/$defs/AudioEvent" }
    },
    "framing": { "$ref": "#/$defs/FaceFraming" },
    "voice": { "$ref": "#/$defs/Voice" }
  },
  "$defs": {
    "Seconds": { "type": "number", "minimum": 0 },
    "SourceInfo": {
      "type": "object",
      "required": ["name", "duration", "video", "audio"],
      "additionalProperties": false,
      "properties": {
        "name": { "description": "The file name, without its folder.", "type": "string" },
        "duration": {
          "description": "Seconds, as the container states it; 0 when it does not.",
          "$ref": "#/$defs/Seconds"
        },
        "start": {
          "description": "The file's time zero, which every other time in the index counts from, as a container timestamp in seconds: where vework's decoder starts the file, which other decoders can place elsewhere. Absent in indexes written before vework recorded it.",
          "type": "number"
        },
        "video": {
          "description": "The first video stream that is footage (cover art is not), or null.",
          "anyOf": [{ "$ref": "#/$defs/VideoStream" }, { "type": "null" }]
        },
        "audio": {
          "description": "Every audio stream, in file order.",
          "type": "array",
          "items": { "$ref": "#/$defs/AudioStream" }
        }
      }
    },
    "VideoStream": {
      "type": "object",
      "required": ["width", "height", "fps", "rotation", "codec"],
      "additionalProperties": false,
      "properties": {
        "width": {
          "description": "Pixels, upright: phone footage stored landscape with a 90° display matrix reports portrait. Pixels that are not square are counted as stored; `sample_aspect` gives their shape.",
          "type": "integer",
          "minimum": 0
        },
        "height": {
          "description": "Pixels, upright, like `width`.",
          "type": "integer",
          "minimum": 0
        },
        "sample_aspect": {
          "description": "The shape of one pixel as displayed, its width over its height: 1 for square pixels, 4/3 for HDV's 1440 × 1080 shown as 16:9. The picture's shape is width × sample_aspect / height. Absent in indexes written before vework recorded it.",
          "type": "number",
          "exclusiveMinimum": 0
        },
        "fps": {
          "description": "Average frame rate; 0 when the stream states none.",
          "type": "number",
          "minimum": 0
        },
        "rotation": {
          "description": "Degrees counter-clockwise from the display matrix.",
          "type": "integer",
          "minimum": 0,
          "maximum": 359
        },
        "codec": { "description": "FFmpeg's codec name, e.g. h264.", "type": "string" },
        "transfer": {
          "description": "The transfer characteristics the stream is tagged with, as an ITU-T H.273 code point: 1 BT.709, 16 PQ (HDR10), 18 HLG; null when untagged. Absent in indexes written before vework recorded it.",
          "type": ["integer", "null"],
          "minimum": 0
        },
        "matrix": {
          "description": "The matrix coefficients the stream is tagged with, as an ITU-T H.273 code point: 1 BT.709, 5 and 6 BT.601, 9 BT.2020; null when untagged. Absent in indexes written before vework recorded it.",
          "type": ["integer", "null"],
          "minimum": 0
        }
      }
    },
    "AudioStream": {
      "type": "object",
      "required": ["index", "channels", "sample_rate", "language"],
      "additionalProperties": false,
      "properties": {
        "index": {
          "description": "Position among the file's audio streams.",
          "type": "integer",
          "minimum": 0
        },
        "channels": { "type": "integer", "minimum": 0 },
        "sample_rate": { "type": "integer", "minimum": 0 },
        "language": {
          "description": "The container's language tag as written (often ISO 639-2, e.g. eng or und), or null.",
          "type": ["string", "null"]
        }
      }
    },
    "ShotTransition": {
      "description": "A hard cut has start == end at the new shot's first frame; a dissolve or fade spans [start, end].",
      "type": "object",
      "required": ["start", "end"],
      "additionalProperties": false,
      "properties": {
        "start": { "$ref": "#/$defs/Seconds" },
        "end": { "$ref": "#/$defs/Seconds" }
      }
    },
    "SpeechSegment": {
      "description": "Seconds at the VAD's sample resolution, not rounded, so a cut at its edge does not clip a word.",
      "type": "object",
      "required": ["start", "end"],
      "additionalProperties": false,
      "properties": {
        "start": { "$ref": "#/$defs/Seconds" },
        "end": { "$ref": "#/$defs/Seconds" }
      }
    },
    "Transcript": {
      "description": "Qwen3-ASR, converted to Taiwan Traditional Chinese, corrected by Claude when asked (see `corrections`) and timed by Qwen3-ForcedAligner, each word edge then placed from the audio below its grid. Empty, with a null language, when the file has no speech.",
      "type": "object",
      "required": ["language", "text", "words"],
      "additionalProperties": false,
      "properties": {
        "language": {
          "description": "BCP 47 code of the language spoken longest (und when unknown), or null without speech.",
          "type": ["string", "null"],
          "pattern": "^[a-z]{2,3}(-[A-Za-z0-9]{1,8})*$"
        },
        "text": {
          "description": "The transcript as written, one line per transcribed chunk.",
          "type": "string"
        },
        "words": {
          "description": "In time order: one word per Han character or English word, carrying the punctuation next to it.",
          "type": "array",
          "items": { "$ref": "#/$defs/Word" }
        }
      }
    },
    "Correction": {
      "description": "One change Claude proposed to a transcribed chunk.",
      "type": "object",
      "required": ["start", "end", "original", "corrected", "reason", "rejected"],
      "additionalProperties": false,
      "properties": {
        "start": {
          "description": "Start of the transcribed chunk the change is in.",
          "$ref": "#/$defs/Seconds"
        },
        "end": { "description": "End of that chunk.", "$ref": "#/$defs/Seconds" },
        "original": {
          "description": "The transcribed text Claude quoted for the change.",
          "type": "string"
        },
        "corrected": {
          "description": "What Claude proposed instead, converted to Taiwan Traditional Chinese.",
          "type": "string"
        },
        "reason": { "description": "Claude's reason for the change.", "type": "string" },
        "rejected": {
          "description": "Why vework did not apply the change, or null when it did.",
          "type": ["string", "null"]
        }
      }
    },
    "Loudness": {
      "description": "EBU R128 loudness of the first audio track, one value per second: value i covers [i, i + 1) s, and a final partial second has one too. Measured at 48 kHz in the track's own channels, weighed as BS.1770 sums them: surround channels by 1.41 and low-frequency effects left out, as FFmpeg's ebur128 filter does. Against that filter's short-term loudness at the source's own rate, every second reads the same to 0.1 LU on the synthetic corpus's speech and drum-and-bass music and on synthetic pink and white noise in mono, stereo and 5.1, at 44.1 and 48 kHz. Empty without audio.",
      "type": "object",
      "required": ["momentary", "short_term"],
      "additionalProperties": false,
      "properties": {
        "momentary": {
          "description": "The loudest 400 ms window inside each second, at 100 ms steps: short peaks such as a laugh, a shout or a hit.",
          "type": "array",
          "items": { "$ref": "#/$defs/Lufs" }
        },
        "short_term": {
          "description": "The 3 s window centred on each second, shifted inward at the ends of the audio: sustained energy.",
          "type": "array",
          "items": { "$ref": "#/$defs/Lufs" }
        }
      }
    },
    "Lufs": {
      "description": "Loudness units relative to full scale, to 0.1. -70, BS.1770's absolute gate, is the floor: silence or anything quieter.",
      "type": "number",
      "minimum": -70
    },
    "AudioEvent": {
      "description": "A stretch where the tagger hears one kind of sound. It listens to 2 s windows, one starting every second, and each window stands for the second at its centre, so an edge falls on a half second and can be off by up to 1.5 s, or on an end of the audio and off by up to 2 s.",
      "type": "object",
      "required": ["kind", "start", "end", "confidence"],
      "additionalProperties": false,
      "properties": {
        "kind": {
          "description": "laughter: any kind of laugh. applause: applause, clapping or cheering. music: any music, also under speech.",
          "enum": ["laughter", "applause", "music"]
        },
        "start": { "$ref": "#/$defs/Seconds" },
        "end": { "$ref": "#/$defs/Seconds" },
        "confidence": {
          "description": "The highest probability the tagger gave this kind inside the stretch, 0 to 1.",
          "type": "number",
          "minimum": 0,
          "maximum": 1
        }
      }
    },
    "FaceFraming": {
      "description": "Faces and who speaks in each shot, for framing the picture in another shape. Faces are found by YuNet in frames sampled `fps` times a second and tracked through each shot; a speaker is the face whose mouth moves most while Silero hears speech. Crop paths are not stored: they depend on the output's shape, and the engine computes them from this. Absent without a picture.",
      "type": "object",
      "required": ["fps", "shots"],
      "additionalProperties": false,
      "properties": {
        "fps": {
          "description": "Frames sampled per second. Each sample is the frame on screen at its time.",
          "type": "number",
          "exclusiveMinimum": 0
        },
        "shots": {
          "description": "Back to back from 0 to the end of the picture, in time order, split at each transition: a hard cut's time, a dissolve's middle.",
          "type": "array",
          "items": { "$ref": "#/$defs/FramedShot" }
        }
      }
    },
    "FramedShot": {
      "type": "object",
      "required": ["start", "end", "layout", "faces", "speakers"],
      "additionalProperties": false,
      "properties": {
        "start": { "$ref": "#/$defs/Seconds" },
        "end": { "$ref": "#/$defs/Seconds" },
        "layout": {
          "description": "talking_head: one person on camera. two_shot: two people of similar size side by side. group: more than two people on camera. screen_cam: no one on camera but a small face in a corner, such as a webcam over a screen recording. screen: no face that counts.",
          "enum": ["talking_head", "two_shot", "group", "screen_cam", "screen"]
        },
        "faces": {
          "description": "Every face seen in enough of the shot to count, in order of id.",
          "type": "array",
          "items": { "$ref": "#/$defs/FaceTrack" }
        },
        "speakers": {
          "description": "Who speaks when, in time order and not overlapping. Speech while no face on screen moves its mouth, such as a voice-over, has no span.",
          "type": "array",
          "items": { "$ref": "#/$defs/SpeakerSpan" }
        }
      }
    },
    "FaceTrack": {
      "description": "One person's face through one shot.",
      "type": "object",
      "required": ["id", "boxes"],
      "additionalProperties": false,
      "properties": {
        "id": {
          "description": "Unique in the index, so speaker spans can name the face. The same person in another shot has another id.",
          "type": "integer",
          "minimum": 0
        },
        "boxes": {
          "description": "The face in each sample it was found in, in time order. Samples where the detector missed it are left out.",
          "type": "array",
          "minItems": 1,
          "items": { "$ref": "#/$defs/FaceBox" }
        }
      }
    },
    "FaceBox": {
      "description": "A face's box at one sample: 0..1 of the displayed picture's width and height, from its top-left corner, as a project's crop rects are, cut off at the picture's edges.",
      "type": "object",
      "required": ["t", "x", "y", "w", "h"],
      "additionalProperties": false,
      "properties": {
        "t": { "description": "The sample's time.", "$ref": "#/$defs/Seconds" },
        "x": { "type": "number", "minimum": 0, "maximum": 1 },
        "y": { "type": "number", "minimum": 0, "maximum": 1 },
        "w": { "type": "number", "exclusiveMinimum": 0, "maximum": 1 },
        "h": { "type": "number", "exclusiveMinimum": 0, "maximum": 1 }
      }
    },
    "SpeakerSpan": {
      "type": "object",
      "required": ["face", "start", "end"],
      "additionalProperties": false,
      "properties": {
        "face": {
          "description": "The id of the face that speaks.",
          "type": "integer",
          "minimum": 0
        },
        "start": { "$ref": "#/$defs/Seconds" },
        "end": { "$ref": "#/$defs/Seconds" }
      }
    },
    "Voice": {
      "description": "The first audio track's speech as voice processing needs it: measured as recorded, and a copy with its noise removed, measured again, which the renderer plays instead of the track. Present when the track has speech. Measured on the track's mono mix at 48 kHz; the mix adds two channels at -3 dB each, so a voice centred in stereo reads 3 dB above either channel.",
      "type": "object",
      "required": ["stem", "model", "recorded", "denoised"],
      "additionalProperties": false,
      "properties": {
        "stem": {
          "description": "The recording beside its denoised speech: the name of a 48 kHz two-channel 32-bit float WAV in the index's folder. Channel 0 is the track's mono mix as measured here, channel 1 the same with its noise removed in full. Both come from one decode, so they line up sample for sample, which two decoders need not do: they differ in the codec priming they drop. Its sample 0 is the source's time zero, and it runs as long as the track. The renderer plays it instead of the track, mixing the recording back in to limit how far noise is lowered.",
          "type": "string",
          "pattern": "^[^/\\\\]*[^/\\\\.][^/\\\\]*$"
        },
        "model": {
          "description": "The denoiser: DeepFilterNet3, run with ONNX Runtime.",
          "const": "DeepFilterNet3"
        },
        "recorded": { "$ref": "#/$defs/VoiceLevels" },
        "denoised": { "$ref": "#/$defs/VoiceLevels" }
      }
    },
    "VoiceLevels": {
      "type": "object",
      "required": [
        "noise_floor_db",
        "speech_lufs",
        "loudness_range_lu",
        "clipped_share",
        "rt60",
        "mud_db",
        "presence_db"
      ],
      "additionalProperties": false,
      "properties": {
        "noise_floor_db": {
          "description": "The room between words: the median RMS level, in dB FS, of the 50 ms windows at least 0.2 s from speech. Null with less than 1 s of them. -120 is digital silence.",
          "type": ["number", "null"],
          "minimum": -120
        },
        "speech_lufs": {
          "description": "Integrated loudness of the speech: BS.1770 with its gates, over the 400 ms windows centred in speech. -70 when they are all quieter than that.",
          "type": "number",
          "minimum": -70
        },
        "loudness_range_lu": {
          "description": "EBU Tech 3342 loudness range of the whole track: how far its loud and quiet stretches lie apart. Uneven levels read high.",
          "type": "number",
          "minimum": 0
        },
        "clipped_share": {
          "description": "The share of the track's sample instants at which any channel is within 0.1 dB of full scale, counted as decoded, before the mono mix. Denoising does not undo clipping, so the denoised speech repeats the recording's figure.",
          "type": "number",
          "minimum": 0,
          "maximum": 1
        },
        "rt60": {
          "description": "Reverberation time, seconds: how long the room takes to fall 60 dB, read from the steepest falls of the 500 Hz–4 kHz level after stretches of speech that a pause follows (worker/README.md#voice has its accuracy). Null with fewer than five falls 15 dB clear of the noise.",
          "type": ["number", "null"],
          "minimum": 0
        },
        "mud_db": {
          "description": "The 150–500 Hz band against the 500 Hz–2 kHz band of the speech's average spectrum, in dB: a boomy or boxy voice reads high. Null without speech energy there.",
          "type": ["number", "null"]
        },
        "presence_db": {
          "description": "The 2–5 kHz band against the 500 Hz–2 kHz band, in dB: a dull or muffled voice reads low.",
          "type": ["number", "null"]
        }
      }
    },
    "Word": {
      "type": "object",
      "required": ["text", "start", "end"],
      "additionalProperties": false,
      "properties": {
        "text": { "type": "string", "minLength": 1 },
        "start": { "$ref": "#/$defs/Seconds" },
        "end": { "$ref": "#/$defs/Seconds" }
      }
    }
  }
}
